[
  {
    "id": "check_python_version",
    "category": "environment",
    "section": "python_env",
    "label": "Python version",
    "description": "Checks if the current Python version is 3.9 or higher.",
    "type": "compare_version",
    "required": true,
    "severity": "error",
    "condition": {
      "target": "python",
      "operator": ">=",
      "value": "3.9"
    },
    "hint": "Use Python 3.9 or higher as required by Azure Functions Python v2.",
    "hint_url": "https://learn.microsoft.com/en-us/azure/azure-functions/functions-reference-python#supported-python-versions",
    "fix_command": "pyenv install 3.9.18",
    "check_order": 1
  },
  {
    "id": "check_venv",
    "category": "environment",
    "section": "python_env",
    "label": "Virtual environment",
    "description": "Checks if a virtual environment is activated.",
    "type": "env_var_exists",
    "required": true,
    "severity": "warning",
    "condition": {
      "target": "VIRTUAL_ENV"
    },
    "hint": "Activate a virtual environment using: 'source venv/bin/activate'.",
    "hint_url": "https://learn.microsoft.com/en-us/azure/azure-functions/functions-best-practices?tabs=python#use-virtual-environments",
    "check_order": 2
  },
  {
    "id": "check_python_executable",
    "category": "environment",
    "section": "python_env",
    "label": "Python executable",
    "description": "Checks if Python executable path exists.",
    "type": "path_exists",
    "required": true,
    "severity": "error",
    "condition": {
      "target": "sys.executable"
    },
    "hint": "Ensure Python is installed and sys.executable points to a valid path.",
    "hint_url": "https://learn.microsoft.com/en-us/azure/azure-functions/functions-reference-python#python-version-and-package-management",
    "check_order": 3
  },
  {
    "id": "check_requirements_txt",
    "category": "dependencies",
    "section": "python_env",
    "label": "requirements.txt",
    "description": "Checks if requirements.txt file exists at the root.",
    "type": "file_exists",
    "required": true,
    "severity": "error",
    "condition": {
      "target": "requirements.txt"
    },
    "hint": "Add a requirements.txt file to specify your dependencies.",
    "hint_url": "https://learn.microsoft.com/en-us/azure/azure-functions/functions-reference-python#managing-dependencies",
    "fix_command": "pip freeze > requirements.txt",
    "check_order": 4
  },
  {
    "id": "check_azure_functions_library",
    "category": "dependencies",
    "section": "python_env",
  "label": "azure-functions package",
  "description": "Checks if the 'azure-functions' package is installed (required for Python Azure Functions projects).",
    "type": "package_installed",
    "required": true,
    "severity": "error",
    "condition": {
  "pypi": "azure-functions",
      "target": "azure.functions"
    },
  "hint": "Install it with: pip install azure-functions",
  "hint_url": "https://learn.microsoft.com/en-us/azure/azure-functions/functions-reference-python",
  "fix_command": "pip install azure-functions",
    "check_order": 5
  },
  {
    "id": "check_host_json",
    "category": "structure",
    "section": "project_structure",
    "label": "host.json",
    "description": "Checks if host.json file exists in the root directory.",
    "type": "file_exists",
    "required": true,
    "severity": "error",
    "condition": {
      "target": "host.json"
    },
    "hint": "host.json is required for configuring Azure Functions host runtime.",
    "hint_url": "https://learn.microsoft.com/en-us/azure/azure-functions/functions-host-json",
    "check_order": 6
  },
  {
    "id": "check_local_settings",
    "category": "structure",
    "section": "project_structure",
    "label": "local.settings.json",
    "description": "Checks if local.settings.json exists (useful for local development).",
    "type": "file_exists",
    "condition": {
      "target": "local.settings.json"
    },
    "required": false,
    "severity": "info",
    "hint": "Create local.settings.json for local development if needed.",
    "check_order": 7
  },
  {
    "id": "check_programming_model_v2",
    "category": "structure",
    "section": "project_structure",
    "label": "Programming Model v2",
    "description": "Detects if the project uses Azure Functions Python Programming Model v2 (decorator-based).",
    "type": "source_code_contains",
    "required": true,
    "severity": "info",
    "condition": {
      "keyword": "@app."
    },
    "hint": "✅ Using Programming Model v2 with @app decorators. This is the recommended modern approach.",
    "hint_url": "https://learn.microsoft.com/en-us/azure/azure-functions/functions-reference-python?tabs=asgi&pivots=python-mode-decorators",
    "check_order": 8
  },
  {
    "id": "check_programming_model_v1",
    "category": "structure",
    "section": "project_structure",
    "label": "Programming Model v1",
    "description": "Detects if the project uses Azure Functions Python Programming Model v1 (function.json-based).",
    "type": "file_exists",
    "required": false,
    "severity": "warning",
    "condition": {
      "target": "function.json"
    },
    "hint": "⚠️ Using Programming Model v1 (function.json-based). Consider migrating to v2 for better developer experience.",
    "hint_url": "https://learn.microsoft.com/en-us/azure/azure-functions/functions-python-develop-v2",
    "check_order": 9
  }
]
